{
  "ecs_version": "1.0",
  "profile_id": "urn:example:disclosure:a",
  "artifact_id": "urn:example:artifact:a",
  "posture": "derived_evidence_only",
  "redactions": [],
  "verification_limits": [
    "source-level independent recomputation unavailable"
  ],
  "consent_or_legal_basis": null,
  "audience_restrictions": [
    "research"
  ]
}
